{
  "schema_version": "1.0",
  "task_id": "TASK-0001",
  "base_commit": "1111111111111111111111111111111111111111",
  "subject_commit": "2222222222222222222222222222222222222222",
  "policy_sha256": "aaaaaaaaaaaaaaaaaaaaaaaaaaaaaaaaaaaaaaaaaaaaaaaaaaaaaaaaaaaaaaaa",
  "source": "hook_pre_commit",
  "kind": "scope_out_of_bounds",
  "summary": {"paths": ["src/aiflow/observation.py", "tests/unit/test_observation.py"]}
}
